    <!ELEMENT mensaje (de,para+,asunto+,adjunto+)>
    <!ELEMENT de (#PCDATA)>
    <!ELEMENT para (#PCDATA)>
    <!ELEMENT asunto (#PCDATA)>
    <!ELEMENT adjunto (#PCDATA)>
    


